[
  {
    "id": "india",
    "name": "India",
    "kind": "country",
    "authority_code": null,
    "authority": "India Meteorological Department",
    "boundary_version": "imd-homogeneous-2026-no-geometry",
    "valid_from": null,
    "valid_to": null,
    "parent_ids": [],
    "aliases": [],
    "geometry_asset": null,
    "geometry_rights": "No map asset included.",
    "evidence_ids": [
      "E-IMD-ALLINDIA-20260923"
    ]
  },
  {
    "id": "india:andhra-pradesh",
    "name": "Andhra Pradesh",
    "kind": "state",
    "authority_code": null,
    "authority": "National Portal of India / NIC",
    "boundary_version": "2026-09-23-roster-no-geometry",
    "valid_from": null,
    "valid_to": null,
    "parent_ids": [
      "india"
    ],
    "aliases": [],
    "geometry_asset": null,
    "geometry_rights": "No boundary asset included; roster names only.",
    "evidence_ids": [
      "E-INDIA-ROSTER-20260923"
    ]
  },
  {
    "id": "india:arunachal-pradesh",
    "name": "Arunachal Pradesh",
    "kind": "state",
    "authority_code": null,
    "authority": "National Portal of India / NIC",
    "boundary_version": "2026-09-23-roster-no-geometry",
    "valid_from": null,
    "valid_to": null,
    "parent_ids": [
      "india"
    ],
    "aliases": [],
    "geometry_asset": null,
    "geometry_rights": "No boundary asset included; roster names only.",
    "evidence_ids": [
      "E-INDIA-ROSTER-20260923"
    ]
  },
  {
    "id": "india:assam",
    "name": "Assam",
    "kind": "state",
    "authority_code": null,
    "authority": "National Portal of India / NIC",
    "boundary_version": "2026-09-23-roster-no-geometry",
    "valid_from": null,
    "valid_to": null,
    "parent_ids": [
      "india"
    ],
    "aliases": [],
    "geometry_asset": null,
    "geometry_rights": "No boundary asset included; roster names only.",
    "evidence_ids": [
      "E-INDIA-ROSTER-20260923"
    ]
  },
  {
    "id": "india:bihar",
    "name": "Bihar",
    "kind": "state",
    "authority_code": null,
    "authority": "National Portal of India / NIC",
    "boundary_version": "2026-09-23-roster-no-geometry",
    "valid_from": null,
    "valid_to": null,
    "parent_ids": [
      "india"
    ],
    "aliases": [],
    "geometry_asset": null,
    "geometry_rights": "No boundary asset included; roster names only.",
    "evidence_ids": [
      "E-INDIA-ROSTER-20260923"
    ]
  },
  {
    "id": "india:chhattisgarh",
    "name": "Chhattisgarh",
    "kind": "state",
    "authority_code": null,
    "authority": "National Portal of India / NIC",
    "boundary_version": "2026-09-23-roster-no-geometry",
    "valid_from": null,
    "valid_to": null,
    "parent_ids": [
      "india"
    ],
    "aliases": [],
    "geometry_asset": null,
    "geometry_rights": "No boundary asset included; roster names only.",
    "evidence_ids": [
      "E-INDIA-ROSTER-20260923"
    ]
  },
  {
    "id": "india:goa",
    "name": "Goa",
    "kind": "state",
    "authority_code": null,
    "authority": "National Portal of India / NIC",
    "boundary_version": "2026-09-23-roster-no-geometry",
    "valid_from": null,
    "valid_to": null,
    "parent_ids": [
      "india"
    ],
    "aliases": [],
    "geometry_asset": null,
    "geometry_rights": "No boundary asset included; roster names only.",
    "evidence_ids": [
      "E-INDIA-ROSTER-20260923"
    ]
  },
  {
    "id": "india:gujarat",
    "name": "Gujarat",
    "kind": "state",
    "authority_code": null,
    "authority": "National Portal of India / NIC",
    "boundary_version": "2026-09-23-roster-no-geometry",
    "valid_from": null,
    "valid_to": null,
    "parent_ids": [
      "india"
    ],
    "aliases": [],
    "geometry_asset": null,
    "geometry_rights": "No boundary asset included; roster names only.",
    "evidence_ids": [
      "E-INDIA-ROSTER-20260923"
    ]
  },
  {
    "id": "india:haryana",
    "name": "Haryana",
    "kind": "state",
    "authority_code": null,
    "authority": "National Portal of India / NIC",
    "boundary_version": "2026-09-23-roster-no-geometry",
    "valid_from": null,
    "valid_to": null,
    "parent_ids": [
      "india"
    ],
    "aliases": [],
    "geometry_asset": null,
    "geometry_rights": "No boundary asset included; roster names only.",
    "evidence_ids": [
      "E-INDIA-ROSTER-20260923"
    ]
  },
  {
    "id": "india:himachal-pradesh",
    "name": "Himachal Pradesh",
    "kind": "state",
    "authority_code": null,
    "authority": "National Portal of India / NIC",
    "boundary_version": "2026-09-23-roster-no-geometry",
    "valid_from": null,
    "valid_to": null,
    "parent_ids": [
      "india"
    ],
    "aliases": [],
    "geometry_asset": null,
    "geometry_rights": "No boundary asset included; roster names only.",
    "evidence_ids": [
      "E-INDIA-ROSTER-20260923"
    ]
  },
  {
    "id": "india:jharkhand",
    "name": "Jharkhand",
    "kind": "state",
    "authority_code": null,
    "authority": "National Portal of India / NIC",
    "boundary_version": "2026-09-23-roster-no-geometry",
    "valid_from": null,
    "valid_to": null,
    "parent_ids": [
      "india"
    ],
    "aliases": [],
    "geometry_asset": null,
    "geometry_rights": "No boundary asset included; roster names only.",
    "evidence_ids": [
      "E-INDIA-ROSTER-20260923"
    ]
  },
  {
    "id": "india:karnataka",
    "name": "Karnataka",
    "kind": "state",
    "authority_code": null,
    "authority": "National Portal of India / NIC",
    "boundary_version": "2026-09-23-roster-no-geometry",
    "valid_from": null,
    "valid_to": null,
    "parent_ids": [
      "india"
    ],
    "aliases": [],
    "geometry_asset": null,
    "geometry_rights": "No boundary asset included; roster names only.",
    "evidence_ids": [
      "E-INDIA-ROSTER-20260923"
    ]
  },
  {
    "id": "india:kerala",
    "name": "Kerala",
    "kind": "state",
    "authority_code": null,
    "authority": "National Portal of India / NIC",
    "boundary_version": "2026-09-23-roster-no-geometry",
    "valid_from": null,
    "valid_to": null,
    "parent_ids": [
      "india"
    ],
    "aliases": [],
    "geometry_asset": null,
    "geometry_rights": "No boundary asset included; roster names only.",
    "evidence_ids": [
      "E-INDIA-ROSTER-20260923"
    ]
  },
  {
    "id": "india:madhya-pradesh",
    "name": "Madhya Pradesh",
    "kind": "state",
    "authority_code": null,
    "authority": "National Portal of India / NIC",
    "boundary_version": "2026-09-23-roster-no-geometry",
    "valid_from": null,
    "valid_to": null,
    "parent_ids": [
      "india"
    ],
    "aliases": [],
    "geometry_asset": null,
    "geometry_rights": "No boundary asset included; roster names only.",
    "evidence_ids": [
      "E-INDIA-ROSTER-20260923"
    ]
  },
  {
    "id": "india:maharashtra",
    "name": "Maharashtra",
    "kind": "state",
    "authority_code": null,
    "authority": "National Portal of India / NIC",
    "boundary_version": "2026-09-23-roster-no-geometry",
    "valid_from": null,
    "valid_to": null,
    "parent_ids": [
      "india"
    ],
    "aliases": [],
    "geometry_asset": null,
    "geometry_rights": "No boundary asset included; roster names only.",
    "evidence_ids": [
      "E-INDIA-ROSTER-20260923"
    ]
  },
  {
    "id": "india:manipur",
    "name": "Manipur",
    "kind": "state",
    "authority_code": null,
    "authority": "National Portal of India / NIC",
    "boundary_version": "2026-09-23-roster-no-geometry",
    "valid_from": null,
    "valid_to": null,
    "parent_ids": [
      "india"
    ],
    "aliases": [],
    "geometry_asset": null,
    "geometry_rights": "No boundary asset included; roster names only.",
    "evidence_ids": [
      "E-INDIA-ROSTER-20260923"
    ]
  },
  {
    "id": "india:meghalaya",
    "name": "Meghalaya",
    "kind": "state",
    "authority_code": null,
    "authority": "National Portal of India / NIC",
    "boundary_version": "2026-09-23-roster-no-geometry",
    "valid_from": null,
    "valid_to": null,
    "parent_ids": [
      "india"
    ],
    "aliases": [],
    "geometry_asset": null,
    "geometry_rights": "No boundary asset included; roster names only.",
    "evidence_ids": [
      "E-INDIA-ROSTER-20260923"
    ]
  },
  {
    "id": "india:mizoram",
    "name": "Mizoram",
    "kind": "state",
    "authority_code": null,
    "authority": "National Portal of India / NIC",
    "boundary_version": "2026-09-23-roster-no-geometry",
    "valid_from": null,
    "valid_to": null,
    "parent_ids": [
      "india"
    ],
    "aliases": [],
    "geometry_asset": null,
    "geometry_rights": "No boundary asset included; roster names only.",
    "evidence_ids": [
      "E-INDIA-ROSTER-20260923"
    ]
  },
  {
    "id": "india:nagaland",
    "name": "Nagaland",
    "kind": "state",
    "authority_code": null,
    "authority": "National Portal of India / NIC",
    "boundary_version": "2026-09-23-roster-no-geometry",
    "valid_from": null,
    "valid_to": null,
    "parent_ids": [
      "india"
    ],
    "aliases": [],
    "geometry_asset": null,
    "geometry_rights": "No boundary asset included; roster names only.",
    "evidence_ids": [
      "E-INDIA-ROSTER-20260923"
    ]
  },
  {
    "id": "india:odisha",
    "name": "Odisha",
    "kind": "state",
    "authority_code": null,
    "authority": "National Portal of India / NIC",
    "boundary_version": "2026-09-23-roster-no-geometry",
    "valid_from": null,
    "valid_to": null,
    "parent_ids": [
      "india"
    ],
    "aliases": [],
    "geometry_asset": null,
    "geometry_rights": "No boundary asset included; roster names only.",
    "evidence_ids": [
      "E-INDIA-ROSTER-20260923"
    ]
  },
  {
    "id": "india:punjab",
    "name": "Punjab",
    "kind": "state",
    "authority_code": null,
    "authority": "National Portal of India / NIC",
    "boundary_version": "2026-09-23-roster-no-geometry",
    "valid_from": null,
    "valid_to": null,
    "parent_ids": [
      "india"
    ],